{
  "$schema": "https://json-schema.org/draft/2020-12/schema",
  "$id": "https://schemas.intellidue.dev/v1/release_lock.schema.json",
  "title": "ReleaseLock",
  "type": "object",
  "additionalProperties": false,
  "required": ["schema_version", "project_id", "release", "status", "release_class", "accepted_product_class", "hard_controls", "next"],
  "properties": {
    "schema_version": {"const": "1.0.0"},
    "project_id": {"type": "string", "pattern": "^[A-Z0-9][A-Z0-9_-]{2,63}$"},
    "release": {"type": "string", "minLength": 1, "maxLength": 160},
    "status": {"enum": ["CURRENT", "ARCHIVED", "SUPERSEDED"]},
    "release_class": {"type": "string", "minLength": 1, "maxLength": 160},
    "accepted_product_class": {"enum": ["PRELIMINARY_RED_FLAG_DD", "FINAL_FULL_DD"]},
    "hard_controls": {
      "type": "object",
      "additionalProperties": false,
      "required": ["critical_gates_open", "restricted_outputs", "decision_ready"],
      "properties": {
        "critical_gates_open": {"type": "integer", "minimum": 0},
        "restricted_outputs": {"type": "array", "uniqueItems": true, "items": {"type": "string", "minLength": 1}, "maxItems": 100},
        "decision_ready": {"type": "boolean"}
      }
    },
    "next": {"type": "string", "minLength": 1, "maxLength": 300}
  }
}
